{
  "spec_version": 1,
  "archetype": "table",
  "source": { "server": "seed:github", "tool": "list_pull_requests" },
  "title_path": "repository.full_name",
  "items_path": "pull_requests",
  "columns": [
    { "label": "Number", "path": "number", "format": "number", "align": "end" },
    { "label": "Title", "path": "title", "align": "start" },
    { "label": "State", "path": "state", "format": "badge" },
    { "label": "Author", "path": "user.login", "format": "user" },
    { "label": "Updated", "path": "updated_at", "format": "datetime" }
  ],
  "link": { "label": "Open on GitHub", "url_path": "html_url" }
}
